{"schema_version": "2.0", "ok": true, "operation": "preflight", "result": {"provider_calls": 0, "execution_boundary": "AGY_NATIVE_ONLY", "agents": {"producer": {"path": ".agents/agents/coursera-producer/agent.md", "sha256": "9a6757d062b256118faef407ba31e059c167d9efa6fb67fe8864cfe3f6f9c27c"}, "worker": {"path": ".agents/agents/coursera-worker/agent.md", "sha256": "7418e2f8d10ad6d5b448cf65f92b63aea96ea4fb1018392ca3cc5fea4ec45e1d"}, "auditor": {"path": ".agents/agents/coursera-auditor/agent.md", "sha256": "3911082c83c17d608a437e562bc8e0c5a49294707a740f0846293316cf27320f"}, "repair": {"path": ".agents/agents/coursera-repair/agent.md", "sha256": "d7cb686d2e9cc3a394f7e423bd1619db7c88df1487bd77e9a6627346f73102b8"}}, "native_invocation": "NOT_VERIFIED", "model_requested": "gemini-3.8-flash-high", "effort_requested": "high", "baselines": {"M02-L11": "VERIFIED_INTACT", "M03-L08": "VERIFIED_INTACT"}, "manifest_sha256": "aa74938c99eb3d3c0046626ca694c0448a9547c4e36e9993066e53a7ea48b503", "policy_sha256": "7a346570fdb0b0d4df0de893eeeda4da39e9fa4b1bcdb8e256cd866b25465809", "renderer_available": true, "concurrency": 1, "default_batch_size": 5, "default_mode": "continuous", "gemini_api": "DISABLED"}}
