{"schema_version": "2.0", "ok": true, "operation": "list-lessons", "result": {"lessons": [{"lesson_id": "M01-L01", "source_type": "VIDEO_TRANSCRIPT", "source_status": "AVAILABLE", "status": "PENDING", "eligible": true}, {"lesson_id": "M01-L02", "source_type": "READING", "source_status": "AVAILABLE", "status": "PENDING", "eligible": true}, {"lesson_id": "M01-L03", "source_type": "READING", "source_status": "AVAILABLE", "status": "PENDING", "eligible": true}, {"lesson_id": "M01-L04", "source_type": "VIDEO_TRANSCRIPT", "source_status": "AVAILABLE", "status": "PENDING", "eligible": true}, {"lesson_id": "M01-L05", "source_type": "VIDEO_TRANSCRIPT", "source_status": "AVAILABLE", "status": "PENDING", "eligible": true}]}}
